[
  {
    "id": 1,
    "code": "11275552",
    "name": "Concertado Ramón y Cajal",
    "type": "Concertado",
    "city": "Jerez de la Frontera",
    "province": "Cádiz",
    "address": "Calle de Cervantes, 72, 4º Dcha.",
    "postal_code": "11055",
    "phone": "+34 956 690 798",
    "student_capacity": 709,
    "founded": 1963
  },
  {
    "id": 2,
    "code": "01463268",
    "name": "CEIP Juan Ramón Jiménez",
    "type": "CEIP",
    "city": "Vitoria-Gasteiz",
    "province": "Álava",
    "address": "Calle de la Iglesia, 171, 2º Izq.",
    "postal_code": "01039",
    "phone": "+34 945 082 326",
    "student_capacity": 397,
    "founded": 1921
  },
  {
    "id": 3,
    "code": "12608142",
    "name": "IES Juan Ramón Jiménez",
    "type": "IES",
    "city": "Castellón de la Plana",
    "province": "Castellón",
    "address": "Calle de las Flores, 77, 9º B",
    "postal_code": "12011",
    "phone": "+34 964 557 181",
    "student_capacity": 1086,
    "founded": 1936
  },
  {
    "id": 4,
    "code": "30912589",
    "name": "Concertado Rosalía de Castro",
    "type": "Concertado",
    "city": "Murcia",
    "province": "Murcia",
    "address": "Calle de la Fuente, 80, 5º Izq.",
    "postal_code": "30015",
    "phone": "+34 968 527 695",
    "student_capacity": 496,
    "founded": 1978
  },
  {
    "id": 5,
    "code": "03459039",
    "name": "Privado Ramón y Cajal",
    "type": "Privado",
    "city": "Alicante",
    "province": "Alicante",
    "address": "Calle de San José, 102, 4º B",
    "postal_code": "03058",
    "phone": "+34 965 356 318",
    "student_capacity": 604,
    "founded": 2017
  },
  {
    "id": 6,
    "code": "15020643",
    "name": "CEIP San Isidoro",
    "type": "CEIP",
    "city": "A Coruña",
    "province": "A Coruña",
    "address": "Calle de San Juan, 68",
    "postal_code": "15031",
    "phone": "+34 981 987 713",
    "student_capacity": 288,
    "founded": 1905
  },
  {
    "id": 7,
    "code": "33216275",
    "name": "CEIP Concepción Arenal",
    "type": "CEIP",
    "city": "Gijón",
    "province": "Asturias",
    "address": "Calle de la Libertad, 115",
    "postal_code": "33043",
    "phone": "+34 985 339 524",
    "student_capacity": 318,
    "founded": 2015
  },
  {
    "id": 8,
    "code": "09233279",
    "name": "IES Blas de Otero",
    "type": "IES",
    "city": "Burgos",
    "province": "Burgos",
    "address": "Calle de Aragón, 92, 7º D",
    "postal_code": "09012",
    "phone": "+34 947 054 865",
    "student_capacity": 1146,
    "founded": 1915
  },
  {
    "id": 9,
    "code": "28010656",
    "name": "CEIP Antonio Machado",
    "type": "CEIP",
    "city": "Madrid",
    "province": "Madrid",
    "address": "Calle de la Fuente, 108",
    "postal_code": "28019",
    "phone": "+34 914 056 284",
    "student_capacity": 519,
    "founded": 1952
  },
  {
    "id": 10,
    "code": "47811097",
    "name": "Concertado Luis Vives",
    "type": "Concertado",
    "city": "Valladolid",
    "province": "Valladolid",
    "address": "Calle de Aragón, 56",
    "postal_code": "47008",
    "phone": "+34 983 018 507",
    "student_capacity": 691,
    "founded": 1932
  }
]
